{
  "phase": "implement",
  "session_id": "2026-09-23T1628-c67a6a",
  "ts": "2026-09-23T16:31:47Z",
  "files_touched": [
    "qor/scripts/check_shadow_threshold.py",
    "tests/test_escalation_origin_signature.py",
    "tests/test_escalation_supersedes.py"
  ],
  "test_summary": {
    "passed": 3530,
    "failed": 0,
    "skipped": 4
  },
  "ai_provenance": {
    "system": "Qor-logic",
    "version": "0.174.2",
    "host": "claude-code",
    "model_family": "unknown",
    "human_oversight": "absent",
    "ts": "2026-09-23T16:31:47Z"
  }
}