{
  "phase": "implement",
  "session_id": "2026-09-16T0224-4f9091",
  "ts": "2026-09-16T02:28:38Z",
  "files_touched": [
    "qor/scripts/session.py",
    "tests/test_session_marker_staleness.py",
    "docs/plan-qor-phase288-session-marker-staleness.md",
    "docs/META_LEDGER.md"
  ],
  "test_summary": {
    "passed": 7,
    "failed": 0,
    "skipped": 0
  },
  "ai_provenance": {
    "system": "Qor-logic",
    "version": "0.174.0",
    "host": "claude-code",
    "model_family": "unknown",
    "human_oversight": "absent",
    "ts": "2026-09-16T02:28:38Z"
  }
}