{
  "phase": "implement",
  "session_id": "2026-06-01T2317-5e8be1",
  "ts": "2026-06-01T23:42:54Z",
  "files_touched": [
    "qor/scripts/feature_index_verify.py",
    "tests/test_feature_index_verify_gate.py",
    "qor/skills/governance/qor-substantiate/SKILL.md",
    "qor/references/doctrine-feature-inventory.md",
    "CHANGELOG.md",
    "README.md"
  ],
  "ai_provenance": {
    "system": "Qor-logic",
    "version": "0.89.0",
    "host": "unknown",
    "model_family": "unknown",
    "human_oversight": "absent",
    "ts": "2026-06-01T23:42:54Z"
  }
}