{
  "phase": "implement",
  "session_id": "2026-06-10T1728-deb672",
  "ts": "2026-06-10T17:33:53Z",
  "files_touched": [
    "tests/test_readme_doctrine_inventory.py",
    "README.md",
    "docs/operations.md",
    "docs/plan-qor-phase160-doc-currency-provenance.md"
  ],
  "test_summary": {
    "passed": 2,
    "failed": 0,
    "skipped": 0
  },
  "ai_provenance": {
    "system": "Qor-logic",
    "version": "0.110.1",
    "host": "unknown",
    "model_family": "unknown",
    "human_oversight": "absent",
    "ts": "2026-06-10T17:33:53Z"
  }
}