{
  "phase": "implement",
  "session_id": "2026-08-01T1437-73f42e",
  "ts": "2026-08-01T15:09:47Z",
  "files_touched": [
    "qor/scripts/badge_layout.py",
    "qor/scripts/badge_currency.py",
    "qor/scripts/seal_artifacts.py",
    "tests/test_badge_layout_resolution.py",
    "tests/test_seal_artifacts.py",
    "tests/test_dry_run_modes.py",
    "qor/references/doctrine-governance-enforcement.md",
    "CHANGELOG.md",
    "docs/plan-qor-phase206-badge-layout-resolution.md",
    "docs/SHADOW_GENOME.md",
    "docs/META_LEDGER.md"
  ],
  "test_summary": {
    "passed": 2721,
    "failed": 0,
    "skipped": 5
  },
  "ai_provenance": {
    "system": "Qor-logic",
    "version": "0.133.0",
    "host": "claude-code",
    "model_family": "opus",
    "human_oversight": "absent",
    "ts": "2026-08-01T15:09:47Z"
  }
}