{
  "phase": "implement",
  "session_id": "2026-06-02T1338-f9aa8b",
  "ts": "2026-06-02T13:47:24Z",
  "files_touched": [
    "tests/test_harness_signal_drift.py",
    "qor/references/doctrine-shadow-genome-countermeasures.md",
    "README.md",
    "CHANGELOG.md"
  ],
  "ai_provenance": {
    "system": "Qor-logic",
    "version": "0.97.0",
    "host": "unknown",
    "model_family": "unknown",
    "human_oversight": "absent",
    "ts": "2026-06-02T13:47:24Z"
  }
}