{
  "phase": "implement",
  "session_id": "2026-08-12T0214-799d77",
  "ts": "2026-08-12T05:53:37Z",
  "files_touched": [
    "qor/scripts/plan_grep_lint.py",
    "qor/references/doctrine-shadow-genome-countermeasures.md",
    "qor/references/glossary.md",
    "docs/plan-qor-phase223-grep-evidence-truth.md",
    "tests/test_plan_grep_evidence_parse.py",
    "tests/test_plan_grep_citation_pairing.py",
    "tests/test_doctrine_citation_pairing.py",
    "tests/test_plan_grep_lint_citation_evidence.py",
    "tests/fixtures/evidence_true.md",
    "tests/fixtures/evidence_false_line.md",
    "tests/fixtures/evidence_unresolvable.md",
    "tests/fixtures/evidence_unpaired.md",
    "tests/fixtures/evidence_block_level_gap.md",
    "tests/fixtures/evidence_duplicate_citation.md",
    "tests/fixtures/evidence_distinct_lines_same_file.md"
  ],
  "test_summary": {
    "passed": 2956,
    "failed": 0,
    "skipped": 6
  },
  "ai_provenance": {
    "system": "Qor-logic",
    "version": "0.145.0",
    "host": "claude-code",
    "model_family": "claude",
    "human_oversight": "absent",
    "ts": "2026-08-12T05:53:37Z"
  }
}