{
  "phase": "implement",
  "session_id": "2026-09-24T1920-8beca6",
  "ts": "2026-09-24T20:10:46Z",
  "files_touched": [
    "tests/test_intent_lock_committed.py",
    "tests/test_ledger_commitment.py",
    "qor/reliability/intent_lock_committed.py",
    "qor/scripts/ledger_commitment.py",
    "qor/references/doctrine-publication-boundary.md",
    "qor/references/glossary.md",
    "docs/plan-shadow-escalation-origin-signature-current.md",
    "docs/plan-qor-phase291-recompose-reconcile-dialect-accessor.md",
    ".qor/intent-lock/2026-09-23T1628-c67a6a.plan.snapshot",
    ".qor/intent-lock/2026-09-23T0645-a3ddc4.plan.snapshot",
    ".qor/intent-lock/2026-09-23T1628-c67a6a.reattest-1.json",
    "docs/META_LEDGER.md",
    "docs/plan-qor-phase296-sealed-evidence-reattestation.md"
  ],
  "test_summary": {
    "passed": 3547,
    "failed": 0,
    "skipped": 6
  },
  "ai_provenance": {
    "system": "Qor-logic",
    "version": "0.174.3",
    "host": "claude-code",
    "model_family": "unknown",
    "human_oversight": "absent",
    "ts": "2026-09-24T20:10:46Z"
  }
}