{
  "phase": "implement",
  "session_id": "2026-05-29T0208-234fbf",
  "ts": "2026-05-29T02:24:35Z",
  "files_touched": [
    "qor/scripts/_lint_utils.py",
    "qor/scripts/plan_signature_widening_caller_lint.py",
    "qor/scripts/plan_data_round_trip_lint.py",
    "qor/scripts/audit_risk_score.py",
    "qor/references/doctrine-shadow-genome-countermeasures.md",
    "qor/skills/sdlc/qor-plan/SKILL.md",
    "qor/skills/governance/qor-audit/SKILL.md",
    "CHANGELOG.md",
    "README.md",
    "docs/META_LEDGER.md",
    "pyproject.toml",
    "tests/test_affected_files_contract_doctrine.py",
    "tests/test_plan_signature_widening_caller_lint.py",
    "tests/test_plan_data_round_trip_lint.py",
    "tests/test_audit_risk_score.py",
    "tests/test_qor_plan_cascade_checklist.py",
    "qor/dist/variants/** (regenerated)"
  ],
  "commits": [],
  "test_summary": {
    "passed": 1997,
    "failed": 0,
    "skipped": 2
  },
  "ai_provenance": {
    "system": "Qor-logic",
    "version": "0.77.0",
    "host": "unknown",
    "model_family": "opus",
    "human_oversight": "absent",
    "ts": "2026-05-29T02:24:35Z"
  }
}