{
  "phase": "implement",
  "session_id": "2026-09-09T0342-9a87f0",
  "ts": "2026-09-09T04:57:43Z",
  "files_touched": [
    "qor/scripts/dialect_ownership_lint.py",
    "tests/test_dialect_ownership_lint.py",
    "qor/scripts/ledger_dialect.py",
    "qor/scripts/verdict_dialect.py",
    "qor/scripts/meta_ledger_walker.py",
    "qor/scripts/ledger_commitment.py",
    "qor/scripts/ledger_migrate.py",
    "qor/scripts/ledger_emit.py",
    "qor/scripts/snapshot_export.py",
    "qor/reliability/ledger_base_currency.py",
    ".qor/dialect-ownership-baseline.json",
    "docs/plan-qor-phase282-dialect-ownership-lint.md",
    "docs/research-brief-dialect-ownership-remeasure-2026-09-09.md",
    "CHANGELOG.md"
  ],
  "test_summary": {
    "suite": "3455 passed, 6 skipped, 0 failed",
    "changed_modules": "test_dialect_ownership_lint.py 26 passed twice",
    "red_before": "26 of 26 failed on ImportError before the module existed",
    "deviation": "D2 cross-check (b) was specified two ways in the audited plan and neither matched the tree. Returned to audit before landing; option A approved with six corrections, all applied. The plan's post-declaration figures moved from prediction to measurement as a result."
  }
}