{
  "phase": "implement",
  "session_id": "2026-09-28T0026-1e38ee",
  "ts": "2026-09-28T02:30:24Z",
  "files_touched": [
    "tests/test_session_marker_staleness.py",
    "qor/scripts/session.py",
    "docs/lifecycle.md",
    "qor/gates/chain.md",
    "qor/references/doctrine-governance-enforcement.md",
    "qor/skills/meta/qor-help/SKILL.md",
    "qor/dist/variants/claude/skills/qor-help/SKILL.md",
    "qor/dist/variants/cline/workflows/command-qor-help.md",
    "qor/dist/variants/codex/skills/qor-help/SKILL.md",
    "qor/dist/variants/cursor/skills/qor-help/SKILL.md",
    "qor/dist/variants/gemini/commands/qor-help.toml",
    "qor/dist/variants/kilo-code/skills/qor-help/SKILL.md",
    "qor/dist/manifest.json",
    "qor/dist/variants/claude/manifest.json",
    "qor/dist/variants/cline/manifest.json",
    "qor/dist/variants/codex/manifest.json",
    "qor/dist/variants/cursor/manifest.json",
    "qor/dist/variants/gemini/manifest.json",
    "qor/dist/variants/kilo-code/manifest.json",
    "docs/release-state.json",
    "CHANGELOG.md",
    "docs/META_LEDGER.md"
  ],
  "test_summary": {
    "passed": 3611,
    "failed": 0,
    "skipped": 3
  },
  "ai_provenance": {
    "system": "Qor-logic",
    "version": "0.175.2",
    "host": "claude-code",
    "model_family": "claude-opus",
    "human_oversight": "absent",
    "ts": "2026-09-28T02:30:24Z"
  }
}