{
  "phase": "implement",
  "session_id": "2026-06-02T1431-2ba7f5",
  "ts": "2026-06-02T14:52:11Z",
  "files_touched": [
    "qor/scripts/shadow_genome_graph.py",
    "tests/test_genome_graph_export.py",
    "docs/shadow-genome-graph-roadmap.md",
    "docs/research-brief-qor-compliance-provenance-2026-05-29.md",
    "README.md",
    "CHANGELOG.md"
  ],
  "ai_provenance": {
    "system": "Qor-logic",
    "version": "0.100.0",
    "host": "unknown",
    "model_family": "unknown",
    "human_oversight": "absent",
    "ts": "2026-06-02T14:52:11Z"
  }
}