{
  "phase": "implement",
  "session_id": "2026-05-24T0600-phase103-p2",
  "ts": "2026-05-24T19:18:12Z",
  "files_touched": [
    ".github/workflows/release.yml",
    "qor/references/doctrine-dependency-admission.md",
    "tests/test_release_workflow_immutability.py",
    "tests/test_doctrine_dependency_admission.py",
    "docs/plan-qor-phase103-pypi-hardening-p2.md",
    "pyproject.toml",
    "CHANGELOG.md",
    "README.md",
    "docs/META_LEDGER.md",
    "docs/SYSTEM_STATE.md"
  ],
  "commits": [],
  "test_summary": {
    "passed": 1919,
    "failed": 0,
    "skipped": 1
  },
  "ai_provenance": {
    "system": "Qor-logic",
    "version": "0.71.0",
    "host": "unknown",
    "model_family": "unknown",
    "human_oversight": "absent",
    "ts": "2026-05-24T19:18:12Z"
  }
}