{
  "phase": "implement",
  "session_id": "2026-04-30T1758-48db18",
  "ts": "2026-05-01T03:12:19Z",
  "files_touched": [
    "CLAUDE.md",
    "README.md",
    "CHANGELOG.md",
    "docs/META_LEDGER.md",
    "docs/SYSTEM_STATE.md",
    "docs/plan-qor-phase54-ai-provenance-and-act-alignment.md",
    "qor/cli.py",
    "qor/cli_handlers/__init__.py",
    "qor/cli_handlers/compliance.py",
    "qor/scripts/ai_provenance.py",
    "qor/scripts/override_friction.py",
    "qor/scripts/sprint_progress.py",
    "qor/scripts/gate_chain.py",
    "qor/scripts/validate_gate_artifact.py",
    "qor/gates/schema/_provenance.schema.json",
    "qor/gates/schema/research.schema.json",
    "qor/gates/schema/plan.schema.json",
    "qor/gates/schema/audit.schema.json",
    "qor/gates/schema/implement.schema.json",
    "qor/gates/schema/substantiate.schema.json",
    "qor/gates/schema/validate.schema.json",
    "qor/gates/schema/shadow_event.schema.json",
    "qor/references/doctrine-eu-ai-act.md",
    "qor/references/doctrine-ai-rmf.md",
    "qor/references/doctrine-governance-enforcement.md",
    "qor/skills/sdlc/qor-research/SKILL.md",
    "qor/skills/sdlc/qor-plan/SKILL.md",
    "qor/skills/sdlc/qor-implement/SKILL.md",
    "qor/skills/sdlc/qor-refactor/SKILL.md",
    "qor/skills/governance/qor-audit/SKILL.md",
    "qor/skills/governance/qor-substantiate/SKILL.md",
    "qor/skills/governance/qor-validate/SKILL.md",
    "qor/skills/meta/qor-repo-audit/SKILL.md",
    "qor/skills/meta/qor-repo-scaffold/SKILL.md",
    "qor/skills/meta/qor-repo-release/SKILL.md",
    "tests/test_ai_provenance_schema.py",
    "tests/test_ai_provenance_helper.py",
    "tests/test_compliance_ai_provenance_cli.py",
    "tests/test_skill_prose_cites_ai_provenance.py",
    "tests/test_doctrine_eu_ai_act_anchored.py",
    "tests/test_doctrine_ai_rmf_anchored.py",
    "tests/test_plan_schema_impact_assessment.py",
    "tests/test_plan_skill_prose_cites_impact_assessment.py",
    "tests/test_skill_frontmatter_permitted_tools.py",
    "tests/test_override_friction_escalator.py",
    "tests/test_skill_prose_handles_friction_exception.py",
    "tests/test_phase54_self_application.py",
    "tests/test_sprint_progress_cli.py",
    "tests/test_compliance_report_post_phase52.py",
    "tests/test_nist_compliance.py"
  ],
  "test_summary": {
    "passed": 1037,
    "failed": 0,
    "skipped": 1
  },
  "ai_provenance": {
    "system": "Qor-logic",
    "version": "0.39.0",
    "host": "unknown",
    "model_family": "unknown",
    "human_oversight": "absent",
    "ts": "2026-05-01T03:12:19Z"
  }
}