{
  "phase": "implement",
  "session_id": "2026-05-02T0330-phase59",
  "ts": "2026-05-02T03:15:48Z",
  "files_touched": [
    "qor/skills/sdlc/qor-ideate/SKILL.md",
    "qor/skills/sdlc/qor-ideate/references/dialogue-protocol.md",
    "qor/gates/schema/ideation.schema.json",
    "qor/scripts/validate_gate_artifact.py",
    "qor/scripts/gate_chain.py",
    "qor/gates/delegation-table.md",
    "qor/gates/chain.md",
    "qor/references/doctrine-ideation-readiness.md",
    "qor/references/doctrine-shadow-genome-countermeasures.md",
    "qor/references/glossary.md",
    "qor/skills/meta/qor-help/SKILL.md",
    "tests/test_ideation_schema_validation.py",
    "tests/test_ideation_schema_round_trip.py",
    "tests/test_qor_research_reads_ideation_artifact.py",
    "tests/test_qor_plan_reads_ideation_artifact.py",
    "tests/test_qor_ideate_skill_admission.py",
    "tests/test_qor_ideate_handoff_matrix.py",
    "tests/test_qor_ideate_writes_gate_artifact.py",
    "tests/test_doctrine_ideation_readiness_anchored.py",
    "tests/test_skill_registry_includes_qor_ideate.py",
    "tests/test_phase59_self_application.py",
    "tests/test_persona_sweep.py",
    "docs/SYSTEM_STATE.md",
    "pyproject.toml",
    "CHANGELOG.md",
    "README.md"
  ],
  "commits": [],
  "test_summary": {
    "passed": 1237,
    "failed": 0,
    "skipped": 1
  },
  "ai_provenance": {
    "system": "Qor-logic",
    "version": "0.45.0",
    "host": "unknown",
    "model_family": "unknown",
    "human_oversight": "absent",
    "ts": "2026-05-02T03:15:48Z"
  }
}