{
  "phase": "implement",
  "session_id": "2026-09-09T2036-2cfe02",
  "ts": "2026-09-11T15:19:52Z",
  "files_touched": [
    "qor/scripts/check_shadow_threshold.py",
    "tests/test_escalation_supersedes.py"
  ],
  "test_summary": {
    "passed": 3480,
    "failed": 0,
    "skipped": 6
  },
  "ai_provenance": {
    "system": "Qor-logic",
    "version": "0.172.1",
    "host": "claude-code",
    "model_family": "opus",
    "human_oversight": "absent",
    "ts": "2026-09-11T15:19:52Z"
  }
}