{
  "phase": "implement",
  "session_id": "2026-06-02T0348-5ce6bc",
  "ts": "2026-06-02T04:08:38Z",
  "files_touched": [
    ".github/workflows/release.yml",
    "tests/test_release_workflow_dispatch.py",
    "README.md"
  ],
  "ai_provenance": {
    "system": "Qor-logic",
    "version": "0.90.0",
    "host": "unknown",
    "model_family": "unknown",
    "human_oversight": "absent",
    "ts": "2026-06-02T04:08:38Z"
  }
}