{
  "phase": "implement",
  "session_id": "2026-08-17T1951-986e79",
  "ts": "2026-08-17T20:37:54Z",
  "files_touched": [
    "qor/scripts/plan_evidence.py",
    "qor/scripts/plan_grep_lint.py",
    "tests/test_plan_evidence_grammar.py",
    "tests/test_plan_grep_canonical_truth.py",
    "tests/test_plan_grep_citation_pairing.py",
    "tests/test_plan_grep_lint_citation_evidence.py",
    "qor/references/doctrine-shadow-genome-countermeasures.md",
    "qor/references/glossary.md",
    "CHANGELOG.md",
    "docs/META_LEDGER.md"
  ],
  "test_summary": {
    "passed": 2975,
    "skipped": 6,
    "failed": 0,
    "determinism_rerun": "32/32 twice"
  },
  "ai_provenance": {
    "system": "Qor-logic",
    "version": "0.146.1",
    "host": "claude-code",
    "model_family": "fable",
    "human_oversight": "absent",
    "ts": "2026-08-17T20:37:54Z"
  }
}