{
  "phase": "implement",
  "session_id": "2026-05-23T0013-0293e5",
  "ts": "2026-05-23T00:26:20Z",
  "files_touched": [
    "qor/skills/governance/qor-audit/SKILL.md",
    "qor/skills/governance/qor-process-review-cycle/SKILL.md",
    "qor/skills/governance/qor-shadow-process/SKILL.md",
    "qor/skills/governance/qor-substantiate/SKILL.md",
    "qor/skills/meta/qor-repo-audit/SKILL.md",
    "qor/skills/sdlc/qor-implement/SKILL.md",
    "qor/skills/sdlc/qor-plan/SKILL.md",
    "qor/references/doctrine-shadow-genome-countermeasures.md",
    "tests/test_skill_environment_block.py",
    "docs/plan-qor-phase90-skill-preflight-and-environment.md",
    "docs/SYSTEM_STATE.md",
    "CHANGELOG.md",
    "pyproject.toml"
  ],
  "test_summary": {
    "passed": 1764,
    "failed": 0,
    "skipped": 1
  },
  "ai_provenance": {
    "system": "Qor-logic",
    "version": "0.61.0",
    "host": "unknown",
    "model_family": "unknown",
    "human_oversight": "absent",
    "ts": "2026-05-23T00:26:20Z"
  }
}