{
  "phase": "implement",
  "session_id": "2026-08-10T1441-005fab",
  "ts": "2026-08-10T15:06:18Z",
  "files_touched": [
    "qor/scripts/publication_boundary_lint.py",
    "tests/test_publication_boundary_lint.py",
    "docs/ecosystem-position.md",
    "docs/integrations/qor-oversight.md",
    "qor/skills/meta/qor-meta-log-decision/SKILL.md",
    "qor/skills/meta/qor-meta-track-shadow/SKILL.md",
    "docs/plan-qor-phase205-codeql-security-baseline.md",
    "docs/plan-qor-phase205-zero-cost-oss-sast.md",
    "docs/plan-qor-phase172-publication-boundary-remediation.md",
    "docs/plan-qor-phase89-ci-commands-reconciliation.md",
    ".qor/gates/2026-07-15T2205-a205c0/plan.json",
    ".qor/gates/2026-07-15T2250-a205c2/plan.json",
    ".qor/gates/2026-07-16T0055-a205c4/plan.json",
    ".github/workflows/ci.yml",
    "qor/references/doctrine-publication-boundary.md",
    ".gitignore",
    "docs/plan-qor-phase208-publication-boundary-sweep.md",
    "docs/META_LEDGER.md"
  ],
  "test_summary": {
    "passed": 2734,
    "failed": 0,
    "skipped": 5
  },
  "ai_provenance": {
    "system": "Qor-logic",
    "version": "0.135.0",
    "host": "claude-code",
    "model_family": "opus",
    "human_oversight": "absent",
    "ts": "2026-08-10T15:06:18Z"
  }
}