{
  "phase": "implement",
  "session_id": "2026-09-02T2038-c5668a",
  "ts": "2026-09-02T21:04:38Z",
  "files_touched": [
    ".agent/staging/AUDIT_REPORT.md",
    ".qor/gates/2026-09-02T2038-c5668a/",
    "README.md",
    "docs/META_LEDGER.md",
    "docs/SHADOW_GENOME.md",
    "docs/plan-qor-phase251-commitment-integrity.md",
    "qor/dist/manifest.json",
    "qor/dist/variants/claude/manifest.json",
    "qor/dist/variants/claude/skills/qor-substantiate/SKILL.md",
    "qor/dist/variants/claude/skills/qor-substantiate/references/seal-gate-ladder.md",
    "qor/dist/variants/cline/manifest.json",
    "qor/dist/variants/cline/workflows/command-qor-substantiate.md",
    "qor/dist/variants/codex/manifest.json",
    "qor/dist/variants/codex/skills/qor-substantiate/SKILL.md",
    "qor/dist/variants/codex/skills/qor-substantiate/references/seal-gate-ladder.md",
    "qor/dist/variants/cursor/manifest.json",
    "qor/dist/variants/cursor/skills/qor-substantiate/SKILL.md",
    "qor/dist/variants/cursor/skills/qor-substantiate/references/seal-gate-ladder.md",
    "qor/dist/variants/gemini/commands/qor-substantiate.toml",
    "qor/dist/variants/gemini/manifest.json",
    "qor/dist/variants/kilo-code/manifest.json",
    "qor/dist/variants/kilo-code/skills/qor-substantiate/SKILL.md",
    "qor/dist/variants/kilo-code/skills/qor-substantiate/references/seal-gate-ladder.md",
    "qor/references/doctrine-ledger-commitment.md",
    "qor/scripts/doc_integrity.py",
    "qor/scripts/layout_paths.py",
    "qor/scripts/ledger_commitment.py",
    "qor/skills/governance/qor-substantiate/SKILL.md",
    "qor/skills/governance/qor-substantiate/references/seal-gate-ladder.md",
    "tests/test_doc_integrity.py",
    "tests/test_ledger_commitment.py"
  ],
  "test_summary": {
    "passed": 3197,
    "failed": 0,
    "skipped": 6
  },
  "ai_provenance": {
    "system": "Qor-logic",
    "version": "0.164.0",
    "host": "claude-code",
    "model_family": "claude",
    "human_oversight": "absent",
    "ts": "2026-09-02T21:04:38Z"
  }
}