{
  "phase": "implement",
  "session_id": "2026-09-02T2142-789e4d",
  "ts": "2026-09-02T22:07:21Z",
  "files_touched": [
    ".agent/staging/AUDIT_REPORT.md",
    ".qor/gates/2026-09-02T2142-789e4d/",
    "docs/META_LEDGER.md",
    "docs/PROCESS_SHADOW_GENOME.md",
    "docs/PROCESS_SHADOW_GENOME_UPSTREAM.md",
    "docs/plan-qor-phase253-remediation-closure-states.md",
    "qor/dist/manifest.json",
    "qor/dist/variants/claude/manifest.json",
    "qor/dist/variants/claude/skills/qor-audit/SKILL.md",
    "qor/dist/variants/cline/manifest.json",
    "qor/dist/variants/cline/workflows/command-qor-audit.md",
    "qor/dist/variants/codex/manifest.json",
    "qor/dist/variants/codex/skills/qor-audit/SKILL.md",
    "qor/dist/variants/cursor/manifest.json",
    "qor/dist/variants/cursor/skills/qor-audit/SKILL.md",
    "qor/dist/variants/gemini/commands/qor-audit.toml",
    "qor/dist/variants/gemini/manifest.json",
    "qor/dist/variants/kilo-code/manifest.json",
    "qor/dist/variants/kilo-code/skills/qor-audit/SKILL.md",
    "qor/gates/schema/shadow_event.schema.json",
    "qor/scripts/check_shadow_threshold.py",
    "qor/scripts/remediate_mark_addressed.py",
    "qor/skills/governance/qor-audit/SKILL.md",
    "tests/test_e2e.py",
    "tests/test_remediation_closure_states.py",
    "tests/test_shadow.py"
  ],
  "test_summary": {
    "passed": 3221,
    "failed": 0,
    "skipped": 6
  },
  "ai_provenance": {
    "system": "Qor-logic",
    "version": "0.166.0",
    "host": "claude-code",
    "model_family": "claude",
    "human_oversight": "absent",
    "ts": "2026-09-02T22:07:21Z"
  }
}