{
  "phase": "implement",
  "session_id": "2026-09-08T2149-c86342",
  "ts": "2026-09-08T22:28:44Z",
  "files_touched": [
    "docs/plan-qor-phase279-marker-unlink-condition.md",
    "docs/research-brief-marker-unlink-condition-2026-09-08.md",
    "qor/scripts/create_shadow_issue.py",
    "tests/test_shadow.py",
    "docs/PROCESS_SHADOW_GENOME.md",
    "CHANGELOG.md"
  ],
  "test_summary": {
    "suite": "3421 passed, 6 skipped, 0 failed",
    "changed_modules": "68 passed twice"
  }
}